{
  "formatVersion": 1,
  "id": "20261001-v4-guards-1-2-0-fixture-contract-record",
  "planId": "20261001-v4-guards-1-2-0-fixture-contract-fix",
  "reason": "The approved Extension Composition test must change together with its ci-contract hash binding. The test derives an always-incompatible major version, while the CI contract changes only that test's SHA-256 entry; all contexts, selection rules, and other approved-test bindings remain unchanged.",
  "entries": [
    {
      "path": "integrations/github/ci-contract.json",
      "baseSha256": "9e893525a48096904f1ad7d24d56276c8c09be7c0e8d79a31c4584afc2365384",
      "headSha256": "9fcc0d3cde750581884fe204347d49872b30a1dfc64001f30932d2e8512ffaf6"
    },
    {
      "path": "tests/p10/Test-V4ExtensionComposition.ps1",
      "baseSha256": "b99f85ec58edcb058bbeb421f7eff29c89593fb2f99518ed65442a4d7516c334",
      "headSha256": "3d375365c1fa12b6213dbe741fe6a87bb977f6aec2b31ab90a48ef13ab4c6500"
    }
  ],
  "acceptedBy": {
    "kind": "human-review",
    "authority": "operator (von12549) — M1–M5 remediation and V4 Guards 1.2.0 release explicitly approved 2026-10-01",
    "candidateHostVerdictAllowed": false
  }
}
