{
  "formatVersion": 1,
  "id": "20260928-v4-todo-014-live-trust-record",
  "planId": "20260928-v4-todo-014-live-trust-change",
  "reason": "V4-TODO-014 B2 live acceptance: P0 checks that the trust policy authorization schema is a bound contract; the CI contract rebinds the P0 hash.",
  "entries": [
    {
      "path": "integrations/github/ci-contract.json",
      "baseSha256": "29740fa9581a79be51a08a3b6f1cca3bb9bc033291a1f44632930a859109b3c0",
      "headSha256": "6d390ecc624d499aec669580af38f62c11d70683f134360948244c27e27d03d2"
    },
    {
      "path": "tests/p0/Test-V4Contracts.ps1",
      "baseSha256": "102facc4d07940c691ca1f79cf0c0c35b991db8f2808e271c16b7db63f312330",
      "headSha256": "dc1bada0eaf8103b43f94a378a6333a13e080b4c2f31d4a861d6d39eebd6aada"
    }
  ],
  "acceptedBy": {
    "kind": "human-review",
    "authority": "operator (von12549) — V4-TODO-014 B2 authorization, 2026-09-28",
    "candidateHostVerdictAllowed": false
  }
}
