{
  "formatVersion": 1,
  "id": "20261001-v4-guards-1-2-0-fixture-record",
  "planId": "20261001-v4-guards-1-2-0-fixture-fix",
  "reason": "The 1.2.0 candidate exposed a version-coupled negative fixture: its incompatible baseVersion was hard-coded to 1.2.0 and became compatible when the product reached 1.2.0. The authorized change derives an always-different major version while preserving the expected Bundle/review/base identity mismatch boundary.",
  "entries": [
    {
      "path": "tests/p10/Test-V4ExtensionComposition.ps1",
      "baseSha256": "b99f85ec58edcb058bbeb421f7eff29c89593fb2f99518ed65442a4d7516c334",
      "headSha256": "3d375365c1fa12b6213dbe741fe6a87bb977f6aec2b31ab90a48ef13ab4c6500"
    }
  ],
  "acceptedBy": {
    "kind": "human-review",
    "authority": "operator (von12549) — M1–M5 remediation and V4 Guards 1.2.0 release explicitly approved 2026-10-01",
    "candidateHostVerdictAllowed": false
  }
}
