{
  "formatVersion": 1,
  "id": "20260928-v4-todo-014-runner-pathext-record",
  "planId": "20260928-v4-todo-014-runner-pathext",
  "reason": "Fix the trusted-base runner's isolated child environment: add PATHEXT to the allowlist so Windows children resolve bare commands such as git (first live Windows smoke run, PR #10, failed P1 with \"The term 'git' is not recognized\").",
  "entries": [
    {
      "path": "integrations/github/Invoke-V4TrustedBase.ps1",
      "baseSha256": "66a1f9706d9c35e2c56d1d77c3f0e35b1ba22efd95f396cc86366b7611b8b121",
      "headSha256": "121a50cb1e2f64eab7682f6927661a80eca24700aaeffca5450f50a07a3ddc3a"
    }
  ],
  "acceptedBy": {
    "kind": "human-review",
    "authority": "operator (von12549) — V4-TODO-014 B2 PATHEXT fix, steps 1-4 approved 2026-09-28",
    "candidateHostVerdictAllowed": false
  }
}
